{
  "$schema": "http://json-schema.org/draft-07/schema#",
  "$id": "graph.schema.json",
  "title": "Lifeblood Semantic Graph",
  "description": "Language-agnostic semantic graph. Any language adapter can output this format. Lifeblood normalizes it and routes it to AI connectors. JSON uses camelCase; C# models use PascalCase. Capability fields have manual names (see CLAUDE.md Serialization Naming).",
  "type": "object",
  "required": ["version", "symbols", "edges"],
  "properties": {
    "version": {
      "type": "string",
      "const": "1.0",
      "description": "Schema version"
    },
    "language": {
      "type": "string",
      "description": "Source language (e.g., csharp, python, typescript, go, rust, java)"
    },
    "adapter": {
      "type": "object",
      "description": "Adapter that produced this graph",
      "properties": {
        "name": { "type": "string" },
        "version": { "type": "string" },
        "capabilities": { "$ref": "#/$defs/capabilities" }
      }
    },
    "modules": {
      "type": "array",
      "items": { "$ref": "#/$defs/module" },
      "description": "Deprecated: modules are now represented as symbols with kind=module. This field is ignored by importers but retained for backwards compatibility."
    },
    "symbols": {
      "type": "array",
      "items": { "$ref": "#/$defs/symbol" }
    },
    "edges": {
      "type": "array",
      "items": { "$ref": "#/$defs/edge" }
    }
  },
  "$defs": {
    "symbol": {
      "type": "object",
      "required": ["id", "name", "kind"],
      "properties": {
        "id": { "type": "string", "description": "Globally unique within this graph" },
        "name": { "type": "string", "description": "Short display name" },
        "qualifiedName": { "type": "string", "description": "Fully qualified name" },
        "kind": { "type": "string", "enum": ["module", "file", "namespace", "type", "method", "field", "property", "parameter"] },
        "filePath": { "type": "string", "description": "Source file path (relative)" },
        "line": { "type": "integer", "minimum": 0, "description": "Line number (1-based)" },
        "parentId": { "type": "string", "description": "Parent symbol ID in containment hierarchy" },
        "visibility": { "type": "string", "enum": ["public", "internal", "protected", "private"] },
        "isAbstract": { "type": "boolean" },
        "isStatic": { "type": "boolean" },
        "properties": {
          "type": "object",
          "additionalProperties": { "type": "string" },
          "description": "Language-specific metadata. Well-known keys: typeKind (class/struct/enum/interface/delegate/record), returnType, paramCount, fieldType, propertyType, isProperty, isEvent, isIndexer, isOperator, eventType"
        }
      }
    },
    "edge": {
      "type": "object",
      "required": ["sourceId", "targetId", "kind"],
      "properties": {
        "sourceId": { "type": "string" },
        "targetId": { "type": "string" },
        "kind": { "type": "string", "enum": ["contains", "dependsOn", "implements", "inherits", "calls", "references", "overrides"] },
        "evidence": { "$ref": "#/$defs/evidence" },
        "callSite": {
          "$ref": "#/$defs/callSite",
          "description": "Authoring provenance for expression-derived edges (Calls / References / member-level Implements). Null / omitted for graph-derived edges with no single authoring location (module→module DependsOn, type→type Inherits without a surfaced clause node). When multiple authoring expressions exist for the same (sourceId, targetId, kind) edge, this records the FIRST observed occurrence — graph-level dedup (`INV-STREAM-005`) collapses repeats. See `INV-EDGE-CALLSITE-001`."
        },
        "properties": {
          "type": "object",
          "additionalProperties": { "type": "string" }
        }
      }
    },
    "callSite": {
      "type": "object",
      "required": ["filePath", "line", "column"],
      "properties": {
        "filePath": { "type": "string", "description": "Repo-relative source-file path with forward-slash separators (matches `SymbolKind.File` symbols' filePath)." },
        "line": { "type": "integer", "minimum": 1, "description": "One-based line number of the authoring expression's start." },
        "column": { "type": "integer", "minimum": 1, "description": "One-based column number of the authoring expression's start." },
        "endLine": { "type": "integer", "minimum": 0, "description": "One-based line number of the authoring expression's end. Zero when not available." },
        "endColumn": { "type": "integer", "minimum": 0, "description": "One-based column number of the authoring expression's end. Zero when not available." },
        "containingSymbolId": { "type": "string", "description": "Canonical id of the lexically enclosing declaration (method, property accessor, field initializer, etc.). Falls back to the containing type id for expressions outside any method-like enclosure. Empty when the extractor could not resolve a containing symbol." }
      }
    },
    "module": {
      "type": "object",
      "required": ["name"],
      "properties": {
        "name": { "type": "string" },
        "filePaths": { "type": "array", "items": { "type": "string" } },
        "dependencies": { "type": "array", "items": { "type": "string" } },
        "isPure": { "type": "boolean" },
        "isTooling": { "type": "boolean" },
        "properties": {
          "type": "object",
          "additionalProperties": { "type": "string" }
        }
      }
    },
    "evidence": {
      "type": "object",
      "required": ["kind", "adapterName", "confidence"],
      "properties": {
        "kind": { "type": "string", "enum": ["syntax", "semantic", "inferred"] },
        "adapterName": { "type": "string" },
        "sourceSpan": { "type": "string", "description": "e.g., src/Auth.cs:47" },
        "confidence": { "type": "string", "enum": ["none", "bestEffort", "proven"] }
      }
    },
    "capabilities": {
      "type": "object",
      "properties": {
        "discoverSymbols": { "type": "boolean" },
        "typeResolution": { "type": "string", "enum": ["none", "bestEffort", "proven"] },
        "callResolution": { "type": "string", "enum": ["none", "bestEffort", "proven"] },
        "implementationResolution": { "type": "string", "enum": ["none", "bestEffort", "proven"] },
        "crossModuleReferences": { "type": "string", "enum": ["none", "bestEffort", "proven"] },
        "overrideResolution": { "type": "string", "enum": ["none", "bestEffort", "proven"] }
      }
    }
  }
}
