{
  "version": "1.0",
  "language": "c",
  "adapter": {
    "name": "native-clang-fixture",
    "version": "0.0.0-fixture",
    "capabilities": {
      "discoverSymbols": true,
      "typeResolution": "proven",
      "callResolution": "proven",
      "implementationResolution": "none",
      "crossModuleReferences": "none",
      "overrideResolution": "none"
    }
  },
  "symbols": [
    {
      "id": "mod:profile-c",
      "name": "profile-c",
      "qualifiedName": "profile-c",
      "kind": "module",
      "properties": {
        "native.kind": "library",
        "native.buildProfile": "audio",
        "native.translationUnitCount": "1",
        "native.defines": "ENABLE_AUDIO=1;PROFILE_NAME=audio"
      }
    },
    {
      "id": "file:src/codec.c",
      "name": "codec.c",
      "qualifiedName": "profile-c/src/codec.c",
      "kind": "file",
      "filePath": "src/codec.c",
      "parentId": "mod:profile-c",
      "properties": {
        "native.kind": "translationUnit",
        "native.buildProfile": "audio"
      }
    },
    {
      "id": "file:src/codec.h",
      "name": "codec.h",
      "qualifiedName": "profile-c/src/codec.h",
      "kind": "file",
      "filePath": "src/codec.h",
      "parentId": "mod:profile-c",
      "properties": {
        "native.kind": "header",
        "native.buildProfile": "audio"
      }
    },
    {
      "id": "field:macro:ENABLE_AUDIO",
      "name": "ENABLE_AUDIO",
      "qualifiedName": "ENABLE_AUDIO",
      "kind": "field",
      "parentId": "mod:profile-c",
      "visibility": "internal",
      "isStatic": true,
      "properties": {
        "native.kind": "macro",
        "native.macroSource": "commandLine",
        "native.macroValue": "1",
        "native.buildProfile": "audio"
      }
    },
    {
      "id": "field:macro:PROFILE_NAME",
      "name": "PROFILE_NAME",
      "qualifiedName": "PROFILE_NAME",
      "kind": "field",
      "parentId": "mod:profile-c",
      "visibility": "internal",
      "isStatic": true,
      "properties": {
        "native.kind": "macro",
        "native.macroSource": "commandLine",
        "native.macroValue": "audio",
        "native.buildProfile": "audio"
      }
    },
    {
      "id": "field:macro:PACKET_BASE",
      "name": "PACKET_BASE",
      "qualifiedName": "PACKET_BASE",
      "kind": "field",
      "filePath": "src/codec.h",
      "line": 4,
      "parentId": "file:src/codec.h",
      "visibility": "internal",
      "isStatic": true,
      "properties": {
        "native.kind": "macro",
        "native.macroSource": "source",
        "native.macroValue": "10",
        "native.buildProfile": "audio"
      }
    },
    {
      "id": "field:macro:PROFILE_KIND",
      "name": "PROFILE_KIND",
      "qualifiedName": "PROFILE_KIND",
      "kind": "field",
      "filePath": "src/codec.c",
      "line": 16,
      "parentId": "file:src/codec.c",
      "visibility": "internal",
      "isStatic": true,
      "properties": {
        "native.kind": "macro",
        "native.macroSource": "source",
        "native.macroValue": "1",
        "native.buildProfile": "audio"
      }
    },
    {
      "id": "type:Packet",
      "name": "Packet",
      "qualifiedName": "Packet",
      "kind": "type",
      "filePath": "src/codec.h",
      "line": 6,
      "parentId": "file:src/codec.h",
      "visibility": "public",
      "properties": {
        "native.kind": "struct",
        "native.linkage": "none",
        "native.buildProfile": "audio"
      }
    },
    {
      "id": "field:Packet.size",
      "name": "size",
      "qualifiedName": "Packet.size",
      "kind": "field",
      "filePath": "src/codec.h",
      "line": 7,
      "parentId": "type:Packet",
      "visibility": "public",
      "properties": {
        "native.kind": "structField",
        "native.fieldType": "int",
        "native.buildProfile": "audio"
      }
    },
    {
      "id": "method:scale_audio(int)",
      "name": "scale_audio",
      "qualifiedName": "scale_audio",
      "kind": "method",
      "filePath": "src/codec.c",
      "line": 18,
      "parentId": "file:src/codec.c",
      "visibility": "private",
      "isStatic": true,
      "properties": {
        "native.kind": "function",
        "native.linkage": "internal",
        "native.signature": "int (int)",
        "native.buildProfile": "audio"
      }
    },
    {
      "id": "method:decode_audio(Packet*)",
      "name": "decode_audio",
      "qualifiedName": "decode_audio",
      "kind": "method",
      "filePath": "src/codec.c",
      "line": 23,
      "parentId": "file:src/codec.c",
      "visibility": "public",
      "properties": {
        "native.kind": "function",
        "native.linkage": "external",
        "native.signature": "int (Packet*)",
        "native.buildProfile": "audio"
      }
    }
  ],
  "edges": [
    {
      "sourceId": "file:src/codec.c",
      "targetId": "file:src/codec.h",
      "kind": "references",
      "evidence": {
        "kind": "syntax",
        "adapterName": "native-clang-fixture",
        "sourceSpan": "src/codec.c:1",
        "confidence": "proven"
      },
      "properties": {
        "native.kind": "include",
        "native.include": "codec.h",
        "native.buildProfile": "audio"
      }
    },
    {
      "sourceId": "file:src/codec.c",
      "targetId": "field:macro:PACKET_BASE",
      "kind": "references",
      "evidence": {
        "kind": "syntax",
        "adapterName": "native-clang-fixture",
        "sourceSpan": "src/codec.c:25",
        "confidence": "proven"
      },
      "properties": {
        "native.referenceKind": "macroExpansion",
        "native.buildProfile": "audio"
      }
    },
    {
      "sourceId": "file:src/codec.c",
      "targetId": "field:macro:PROFILE_KIND",
      "kind": "references",
      "evidence": {
        "kind": "syntax",
        "adapterName": "native-clang-fixture",
        "sourceSpan": "src/codec.c:20",
        "confidence": "proven"
      },
      "properties": {
        "native.referenceKind": "macroExpansion",
        "native.buildProfile": "audio"
      }
    },
    {
      "sourceId": "method:decode_audio(Packet*)",
      "targetId": "method:scale_audio(int)",
      "kind": "calls",
      "evidence": {
        "kind": "semantic",
        "adapterName": "native-clang-fixture",
        "sourceSpan": "src/codec.c:25",
        "confidence": "proven"
      },
      "properties": {
        "native.callKind": "direct",
        "native.buildProfile": "audio"
      }
    },
    {
      "sourceId": "method:decode_audio(Packet*)",
      "targetId": "type:Packet",
      "kind": "references",
      "evidence": {
        "kind": "semantic",
        "adapterName": "native-clang-fixture",
        "sourceSpan": "src/codec.c:23",
        "confidence": "proven"
      },
      "properties": {
        "native.referenceKind": "parameterType",
        "native.buildProfile": "audio"
      }
    },
    {
      "sourceId": "method:decode_audio(Packet*)",
      "targetId": "field:Packet.size",
      "kind": "references",
      "evidence": {
        "kind": "semantic",
        "adapterName": "native-clang-fixture",
        "sourceSpan": "src/codec.c:25",
        "confidence": "proven"
      },
      "properties": {
        "native.referenceKind": "fieldAccess",
        "native.buildProfile": "audio"
      }
    }
  ]
}
